Title,Media URL,Pinterest board,Description,Link,Publish date,Keywords
Definition of spanish heath,https://dl.dropboxusercontent.com/scl/fi/pnfr27o5h8xcbqs5re41f/image-71.jpg?rlkey=vx9qfs0t7aj11i92gvet5yi7s&dl=1,definitions/English,erect dense shrub native to western Iberian peninsula having profuse white or pink flowers; naturalized in southwestern England,https://trueandfiction.com/definition/definition-of-spanish-heath/,2024-12-28T01:10,"definition, meaning, english, vocabulary, spanish heath"
Definition of gushing,https://dl.dropboxusercontent.com/scl/fi/ttt108q5yqn3qk3ajvq29/image-72.jpg?rlkey=xalsj5juo4lginyhfrp5u04yt&dl=1,definitions/English,uttered with unrestrained enthusiasm,https://trueandfiction.com/definition/definition-of-gushing/,2024-12-28T01:11,"definition, meaning, english, vocabulary, gushing"
Definition of tephrosia purpurea,https://dl.dropboxusercontent.com/scl/fi/726m2csecrm12wpfaic1h/image-73.jpg?rlkey=p09y8yuxv5ebhsuxm42gj4ywb&dl=1,definitions/English,East Indian shrub,https://trueandfiction.com/definition/definition-of-tephrosia-purpurea/,2024-12-28T01:12,"definition, meaning, english, vocabulary, tephrosia purpurea"
Definition of reducer,https://dl.dropboxusercontent.com/scl/fi/qziovfsj4gua8lrfi52cm/image-74.jpg?rlkey=7xdwvlsm5c98dg2y354m5vj9s&dl=1,definitions/English,pipefitting that joins two pipes of different diameter,https://trueandfiction.com/definition/definition-of-reducer/,2024-12-28T01:14,"definition, meaning, english, vocabulary, reducer"
Definition of swoosh,https://dl.dropboxusercontent.com/scl/fi/ic6u5z0m00d1hrxcj2egz/image-75.jpg?rlkey=5bmxhbdgaa9fautz05qe9v06r&dl=1,definitions/English,move with or cause to move with a whistling or hissing sound,https://trueandfiction.com/definition/definition-of-swoosh/,2024-12-28T01:15,"definition, meaning, english, vocabulary, swoosh"
Definition of minor premise,https://dl.dropboxusercontent.com/scl/fi/62lq0owy7eg3riucx8ckg/image-76.jpg?rlkey=t0ap0m795ohnasicaijuj0uid&dl=1,definitions/English,the premise of a syllogism that contains the minor term (which is the subject of the conclusion),https://trueandfiction.com/definition/definition-of-minor-premise/,2024-12-28T01:16,"definition, meaning, english, vocabulary, minor premise"
Definition of gas furnace,https://dl.dropboxusercontent.com/scl/fi/zd5bkpjsmygjsxk2o1l8r/image-77.jpg?rlkey=izitxk4y1xspsj4zmqf3z490l&dl=1,definitions/English,a furnace that burns gas,https://trueandfiction.com/definition/definition-of-gas-furnace/,2024-12-28T01:18,"definition, meaning, english, vocabulary, gas furnace"
Definition of utterness,https://dl.dropboxusercontent.com/scl/fi/i66pj8zw5z12o4sk6mk1z/image-78.jpg?rlkey=eet6fv8fucvxn7ov5c8dov2ru&dl=1,definitions/English,the quality of being complete or utter or extreme,https://trueandfiction.com/definition/definition-of-utterness/,2024-12-28T01:19,"definition, meaning, english, vocabulary, utterness"
Definition of garden cress,https://dl.dropboxusercontent.com/scl/fi/8kgs4dxt9rbkxuo5o155e/image-79.jpg?rlkey=j16mobnhzei1nceh4sfls6pbp&dl=1,definitions/English,cress cultivated for salads and garnishes,https://trueandfiction.com/definition/definition-of-garden-cress/,2024-12-28T01:21,"definition, meaning, english, vocabulary, garden cress"
Definition of genus stenotaphrum,https://dl.dropboxusercontent.com/scl/fi/3vwgt0kg2tq8g48bfu7m3/image-80.jpg?rlkey=6vltotvy4g6wdbyj51ds7smfr&dl=1,definitions/English,lawn grasses,https://trueandfiction.com/definition/definition-of-genus-stenotaphrum/,2024-12-28T01:22,"definition, meaning, english, vocabulary, genus stenotaphrum"
Definition of marlene dietrich,https://dl.dropboxusercontent.com/scl/fi/s64x7936s9q1zfw9dq1ph/image-81.jpg?rlkey=htwm9xkbzryjj059ftcfbklke&dl=1,definitions/English,United States film actress (born in Germany) who made many films with Josef von Sternberg and later was a successful cabaret star (1901-1992),https://trueandfiction.com/definition/definition-of-marlene-dietrich/,2024-12-28T01:23,"definition, meaning, english, vocabulary, marlene dietrich"
Definition of phospholipid,https://dl.dropboxusercontent.com/scl/fi/v35gdh803nmszaz8o9phn/image-82.jpg?rlkey=mycesa14gn91kkh2grurjrd4r&dl=1,definitions/English,any of various compounds composed of fatty acids and phosphoric acid and a nitrogenous base; an important constituent of membranes,https://trueandfiction.com/definition/definition-of-phospholipid/,2024-12-28T01:25,"definition, meaning, english, vocabulary, phospholipid"
Definition of poker,https://dl.dropboxusercontent.com/scl/fi/le7plcc6bu9w1pogk524o/image-83.jpg?rlkey=elwsrx7ogee8yepctpts56oli&dl=1,definitions/English,any of various card games in which players bet that they hold the highest-ranking hand,https://trueandfiction.com/definition/definition-of-poker/,2024-12-28T01:26,"definition, meaning, english, vocabulary, poker"
Definition of helsinki,https://dl.dropboxusercontent.com/scl/fi/dv8orjlrncpztjatfyv7e/image-84.jpg?rlkey=kyh1ldiiuyvtuph1xmlj4edhs&dl=1,definitions/English,the capital and largest city of Finland; located in southern Finland; a major port and commercial and cultural center,https://trueandfiction.com/definition/definition-of-helsinki/,2024-12-28T01:28,"definition, meaning, english, vocabulary, helsinki"
Definition of fire tower,https://dl.dropboxusercontent.com/scl/fi/okyuwfbt6sao1n4kv9h7n/image-85.jpg?rlkey=f6ui87t8laefn07nb3cy6g01m&dl=1,definitions/English,a watchtower where a lookout is posted to watch for fires,https://trueandfiction.com/definition/definition-of-fire-tower/,2024-12-28T01:29,"definition, meaning, english, vocabulary, fire tower"
Definition of debugger,https://dl.dropboxusercontent.com/scl/fi/pss8gum1yf78ma85tixvw/image-86.jpg?rlkey=9z8evnd8zoxdkxgyw2yx2ice1&dl=1,definitions/English,a program that helps in locating and correcting programming errors,https://trueandfiction.com/definition/definition-of-debugger/,2024-12-28T01:31,"definition, meaning, english, vocabulary, debugger"
Definition of cheerless,https://dl.dropboxusercontent.com/scl/fi/x14thrcg5zwa255ft7dar/image-87.jpg?rlkey=0t192r885ix8ucsqc14yqpr97&dl=1,definitions/English,causing sad feelings of gloom and inadequacy,https://trueandfiction.com/definition/definition-of-cheerless/,2024-12-28T01:33,"definition, meaning, english, vocabulary, cheerless"
Definition of bagpiper,https://dl.dropboxusercontent.com/scl/fi/zne8mo7ngpzlqj7u14pon/image-88.jpg?rlkey=tzw47mmm0jin3w609qlv2l2ov&dl=1,definitions/English,someone who plays the bagpipe,https://trueandfiction.com/definition/definition-of-bagpiper/,2024-12-28T01:34,"definition, meaning, english, vocabulary, bagpiper"
Definition of sound effect,https://dl.dropboxusercontent.com/scl/fi/k3tpqvgmjzdd27byqd5mp/image-89.jpg?rlkey=5czpp02n1eptwujiqdkbs68pz&dl=1,definitions/English,an effect that imitates a sound called for in the script of a play,https://trueandfiction.com/definition/definition-of-sound-effect/,2024-12-28T01:36,"definition, meaning, english, vocabulary, sound effect"
Definition of taffy,https://dl.dropboxusercontent.com/scl/fi/8tyne0vpeaoc10sscf7p2/image-90.jpg?rlkey=4mwjn7eos0pax87cmug3sybtk&dl=1,definitions/English,chewy candy of sugar or syrup boiled until thick and pulled until glossy,https://trueandfiction.com/definition/definition-of-taffy/,2024-12-28T01:37,"definition, meaning, english, vocabulary, taffy"
Definition of frankfurt on the main,https://dl.dropboxusercontent.com/scl/fi/ewogiq12q5dwoyib62dvv/image-91.jpg?rlkey=prk4fmhr5y1izboyk02186jzv&dl=1,definitions/English,a German city; an industrial and commercial and financial center,https://trueandfiction.com/definition/definition-of-frankfurt-on-the-main/,2024-12-28T01:39,"definition, meaning, english, vocabulary, frankfurt on the main"
Definition of spectrum analysis,https://dl.dropboxusercontent.com/scl/fi/r0v8rf7ktcg2z6rz21bkc/image-92.jpg?rlkey=ig4692owk8x7rlkde57gf3s0g&dl=1,definitions/English,the use of spectroscopes to analyze spectra,https://trueandfiction.com/definition/definition-of-spectrum-analysis/,2024-12-28T01:41,"definition, meaning, english, vocabulary, spectrum analysis"
Definition of manic,https://dl.dropboxusercontent.com/scl/fi/8g6k1n8q3dpoi8xkf07ub/image-93.jpg?rlkey=jy863q0vjwubk3mkv09ws1cpm&dl=1,definitions/English,affected with or marked by frenzy or mania uncontrolled by reason,https://trueandfiction.com/definition/definition-of-manic/,2024-12-28T01:43,"definition, meaning, english, vocabulary, manic"
Definition of william henry hoover,https://dl.dropboxusercontent.com/scl/fi/2wgilrjxvwe7qn4rc15g7/image-94.jpg?rlkey=rb0rm0fkrpgmpgwkhyfk076ie&dl=1,definitions/English,United States industrialist who manufactured vacuum cleaners (1849-1932),https://trueandfiction.com/definition/definition-of-william-henry-hoover/,2024-12-28T01:44,"definition, meaning, english, vocabulary, william henry hoover"
Definition of rheum palmatum,https://dl.dropboxusercontent.com/scl/fi/0xwmb93zn8klwpuqyyhgh/image-95.jpg?rlkey=s1t6hydkvszdmamts9otbk7q1&dl=1,definitions/English,long used for laxative properties,https://trueandfiction.com/definition/definition-of-rheum-palmatum/,2024-12-28T01:46,"definition, meaning, english, vocabulary, rheum palmatum"
Definition of carious,https://dl.dropboxusercontent.com/scl/fi/r6tmq55x1l58n7ejy0as2/image-96.jpg?rlkey=l15ieao4gsj3umkrd7sar7lyc&dl=1,definitions/English,(of teeth) affected with cavities or decay,https://trueandfiction.com/definition/definition-of-carious/,2024-12-28T01:48,"definition, meaning, english, vocabulary, carious"
Definition of angle of view,https://dl.dropboxusercontent.com/scl/fi/n0jnla42hnjm2t33pvd3o/image-97.jpg?rlkey=a7s8noko3bkoygdgb98k9bss6&dl=1,definitions/English,the angle included by a photographic lens,https://trueandfiction.com/definition/definition-of-angle-of-view/,2024-12-28T01:50,"definition, meaning, english, vocabulary, angle of view"
Definition of wiggle,https://dl.dropboxusercontent.com/scl/fi/6vewafom8xmkomggv5ibj/image-98.jpg?rlkey=u1o7qmcq0wljptiwbr23g8j7e&dl=1,definitions/English,move to and fro,https://trueandfiction.com/definition/definition-of-wiggle/,2024-12-28T01:52,"definition, meaning, english, vocabulary, wiggle"
Definition of deltoid leaf,https://dl.dropboxusercontent.com/scl/fi/t0lnwqgndzhpy5mhvp0bh/image-99.jpg?rlkey=172jlbo2lrrozjipg0ovymm4z&dl=1,definitions/English,a simple leaf shaped like a capital delta,https://trueandfiction.com/definition/definition-of-deltoid-leaf/,2024-12-28T01:53,"definition, meaning, english, vocabulary, deltoid leaf"
