Title,Media URL,Pinterest board,Description,Link,Publish date,Keywords
Definition of corn liquor,https://dl.dropboxusercontent.com/scl/fi/6y5zyehd56cnzxghkqa6k/image-200.jpg?rlkey=da1m2z10h1vhfl974td5s73z2&dl=1,definitions/English,whiskey illegally distilled from a corn mash,https://trueandfiction.com/definition/definition-of-corn-liquor/,2024-12-28T18:21,"definition, meaning, english, vocabulary, corn liquor"
Definition of apractic,https://dl.dropboxusercontent.com/scl/fi/vhs83u89tbdscyrgv7kry/image-201.jpg?rlkey=h3792hakqc2oy1rzutq68p9no&dl=1,definitions/English,"having uncoordinated muscular movements, symptomatic of a CNS disorder",https://trueandfiction.com/definition/definition-of-apractic/,2024-12-28T18:23,"definition, meaning, english, vocabulary, apractic"
Definition of hagerstown,https://dl.dropboxusercontent.com/scl/fi/bbxkgex9xd1ou83bz3zn0/image-202.jpg?rlkey=n26fm9hizrzqeqp8d8i8o214j&dl=1,definitions/English,a town in northern Maryland,https://trueandfiction.com/definition/definition-of-hagerstown/,2024-12-28T18:25,"definition, meaning, english, vocabulary, hagerstown"
Definition of myrtillocactus,https://dl.dropboxusercontent.com/scl/fi/twk6pcqg8hbxavomr7gsf/image-203.jpg?rlkey=esnbhbi198kljzgcu8u8yi40p&dl=1,definitions/English,small genus of arborescent cacti of Mexico and Central America,https://trueandfiction.com/definition/definition-of-myrtillocactus/,2024-12-28T18:27,"definition, meaning, english, vocabulary, myrtillocactus"
Definition of south yorkshire,https://dl.dropboxusercontent.com/scl/fi/eiw8wg6mra7f80cf5snly/image-204.jpg?rlkey=op18zpjdb3bha22b6hjsn2pc4&dl=1,definitions/English,a metropolitan county in northern England,https://trueandfiction.com/definition/definition-of-south-yorkshire/,2024-12-28T18:29,"definition, meaning, english, vocabulary, south yorkshire"
Definition of plastid,https://dl.dropboxusercontent.com/scl/fi/cw12l9u302v8lforh36um/image-205.jpg?rlkey=bcn0cwv0v32fbajl3ek7o0pc9&dl=1,definitions/English,any of various small particles in the cytoplasm of the cells of plants and some animals containing pigments or starch or oil or protein,https://trueandfiction.com/definition/definition-of-plastid/,2024-12-28T18:31,"definition, meaning, english, vocabulary, plastid"
Definition of trinidad and tobago dollar,https://dl.dropboxusercontent.com/scl/fi/f46e3bes8jifguzh6asym/image-206.jpg?rlkey=vqv2j2cfu1ljmfjetj08i3a36&dl=1,definitions/English,the basic unit of money in Trinidad and Tobago,https://trueandfiction.com/definition/definition-of-trinidad-and-tobago-dollar/,2024-12-28T18:33,"definition, meaning, english, vocabulary, trinidad and tobago dollar"
Definition of clappers,https://dl.dropboxusercontent.com/scl/fi/uqgw6r1v0vdi552zit9g1/image-207.jpg?rlkey=wt5fvodthpgklmbvksxea84kz&dl=1,definitions/English,(used in the plural) a percussion instrument consisting of a pair of hollow pieces of wood or bone (usually held between the thumb and fingers) that are made to click together (as by Spanish dancers) in rhythm with the dance,https://trueandfiction.com/definition/definition-of-clappers/,2024-12-28T18:35,"definition, meaning, english, vocabulary, clappers"
Definition of wrongful,https://dl.dropboxusercontent.com/scl/fi/8fdcc15112l9artnzqz9r/image-208.jpg?rlkey=a0xbbokz7et8nxp4hzshvj9tj&dl=1,definitions/English,having no legally established claim,https://trueandfiction.com/definition/definition-of-wrongful/,2024-12-28T18:38,"definition, meaning, english, vocabulary, wrongful"
Definition of onion butter,https://dl.dropboxusercontent.com/scl/fi/b4i4a7dt4z8k5dr194tkh/image-209.jpg?rlkey=kyyqafctbcqu30v32dc4f3ju3&dl=1,definitions/English,butter blended with minced onion,https://trueandfiction.com/definition/definition-of-onion-butter/,2024-12-28T18:40,"definition, meaning, english, vocabulary, onion butter"
Definition of eucinostomus,https://dl.dropboxusercontent.com/scl/fi/q4vocdbgx7y9vnfk6t0g5/image-210.jpg?rlkey=wnm0pyril3x4bqtb485kudi2w&dl=1,definitions/English,a genus of Gerreidae,https://trueandfiction.com/definition/definition-of-eucinostomus/,2024-12-28T18:42,"definition, meaning, english, vocabulary, eucinostomus"
Definition of plus sign,https://dl.dropboxusercontent.com/scl/fi/d7hn3mf957qbl2njttvqz/image-211.jpg?rlkey=0k2cbijw839aen0ojt74kmob8&dl=1,definitions/English,a sign indicating the operation of addition,https://trueandfiction.com/definition/definition-of-plus-sign/,2024-12-28T18:44,"definition, meaning, english, vocabulary, plus sign"
Definition of fiesta flower,https://dl.dropboxusercontent.com/scl/fi/ydpplswz3ldl3ajie35jj/image-212.jpg?rlkey=859mmsh85j27mce70jlw2crmy&dl=1,definitions/English,straggling California annual herb with deep purple or violet flowers; sometimes placed in genus Nemophila,https://trueandfiction.com/definition/definition-of-fiesta-flower/,2024-12-28T18:47,"definition, meaning, english, vocabulary, fiesta flower"
Definition of casern,https://dl.dropboxusercontent.com/scl/fi/9mwo6v99xg9gpkqyr6hq6/image-213.jpg?rlkey=jgnf7e6pjawwh0ug7p86qquo1&dl=1,definitions/English,military barracks in a garrison town,https://trueandfiction.com/definition/definition-of-casern/,2024-12-28T18:49,"definition, meaning, english, vocabulary, casern"
Definition of commonness,https://dl.dropboxusercontent.com/scl/fi/yfxacs28jxr23krav2ljz/image-214.jpg?rlkey=adddvsnruxmtkdfj3bl8iylyg&dl=1,definitions/English,sharing of common attributes,https://trueandfiction.com/definition/definition-of-commonness/,2024-12-28T18:52,"definition, meaning, english, vocabulary, commonness"
Definition of ambulatory plague,https://dl.dropboxusercontent.com/scl/fi/ucsmogkzqik3gvrupc5i1/image-216.jpg?rlkey=by4epy2g4hy3a8xt0n7pv6ryw&dl=1,definitions/English,a mild form of bubonic plague,https://trueandfiction.com/definition/definition-of-ambulatory-plague/,2024-12-28T18:56,"definition, meaning, english, vocabulary, ambulatory plague"
Definition of genus austrocedrus,https://dl.dropboxusercontent.com/scl/fi/smkecisy6bqpxdcamwe1j/image-217.jpg?rlkey=5g34aar2jp4ijwml1iazp3uga&dl=1,definitions/English,one species; formerly included in genus Libocedrus,https://trueandfiction.com/definition/definition-of-genus-austrocedrus/,2024-12-28T18:59,"definition, meaning, english, vocabulary, genus austrocedrus"
Definition of red buckeye,https://dl.dropboxusercontent.com/scl/fi/j9cu49p2qg6y78v7paf23/image-218.jpg?rlkey=5donrr4sy080avl5crflnst9w&dl=1,definitions/English,a shrub buckeye of southern United States,https://trueandfiction.com/definition/definition-of-red-buckeye/,2024-12-28T19:02,"definition, meaning, english, vocabulary, red buckeye"
Definition of commerce secretary,https://dl.dropboxusercontent.com/scl/fi/sgjnrgz7v61f8frk2hmp6/image-219.jpg?rlkey=epk9kylkohcqmvmnz4gi67nr5&dl=1,definitions/English,the position of the head of the Department of Commerce,https://trueandfiction.com/definition/definition-of-commerce-secretary/,2024-12-28T19:04,"definition, meaning, english, vocabulary, commerce secretary"
Definition of grey skate,https://dl.dropboxusercontent.com/scl/fi/78ouktqsnidlsj1rlnx1y/image-220.jpg?rlkey=gcuws9wqpylxskfymmf46p15g&dl=1,definitions/English,common European skate used as food,https://trueandfiction.com/definition/definition-of-grey-skate/,2024-12-28T19:07,"definition, meaning, english, vocabulary, grey skate"
Definition of subgenus,https://dl.dropboxusercontent.com/scl/fi/51vvl80wdcz13l7lhh53b/image-221.jpg?rlkey=zbmt9luj3jaccpdia1hihr9ei&dl=1,definitions/English,(biology) taxonomic group between a genus and a species,https://trueandfiction.com/definition/definition-of-subgenus/,2024-12-28T19:09,"definition, meaning, english, vocabulary, subgenus"
Definition of arrester,https://dl.dropboxusercontent.com/scl/fi/4g81xcxgh2pimo66kb9af/image-222.jpg?rlkey=p926qlxmh80ilgt1wj3ppi8ls&dl=1,definitions/English,a restraint that slows airplanes as they land on the flight deck of an aircraft carrier,https://trueandfiction.com/definition/definition-of-arrester/,2024-12-28T19:12,"definition, meaning, english, vocabulary, arrester"
Definition of muenchen,https://dl.dropboxusercontent.com/scl/fi/x9y5wu7rc1sgqmm8r0990/image-223.jpg?rlkey=lhi0mnj8p60jf1f0ev8va5787&dl=1,definitions/English,the capital and largest city of Bavaria in southwestern Germany,https://trueandfiction.com/definition/definition-of-muenchen/,2024-12-28T19:15,"definition, meaning, english, vocabulary, muenchen"
Definition of prison cell,https://dl.dropboxusercontent.com/scl/fi/rmvlrcssre0v7rfw9he8q/image-224.jpg?rlkey=fd2af2kvzqh0xj3ejgbnoygzi&dl=1,definitions/English,a room where a prisoner is kept,https://trueandfiction.com/definition/definition-of-prison-cell/,2024-12-28T19:18,"definition, meaning, english, vocabulary, prison cell"
Definition of roundly,https://dl.dropboxusercontent.com/scl/fi/gedhcyw5r6w1lw7bi36ia/image-225.jpg?rlkey=ml6lxryth7m1s82lfaayqm7l2&dl=1,definitions/English,in a round manner,https://trueandfiction.com/definition/definition-of-roundly/,2024-12-28T19:20,"definition, meaning, english, vocabulary, roundly"
Definition of republic of mauritius,https://dl.dropboxusercontent.com/scl/fi/uvq4b1cokcopz22qpx878/image-226.jpg?rlkey=b7xiw7nlmegrqrtz82sr6af2x&dl=1,definitions/English,a parliamentary state on the island of Mauritius,https://trueandfiction.com/definition/definition-of-republic-of-mauritius/,2024-12-28T19:23,"definition, meaning, english, vocabulary, republic of mauritius"
Definition of genus lecanora,https://dl.dropboxusercontent.com/scl/fi/vhgvsk5k3r5gfa2zqqqot/image-227.jpg?rlkey=ltzog1o9b01gs8nvjzj3ttypv&dl=1,definitions/English,type genus of Lecanoraceae; crustaceous lichens,https://trueandfiction.com/definition/definition-of-genus-lecanora/,2024-12-28T19:26,"definition, meaning, english, vocabulary, genus lecanora"
Definition of fonteyn,https://dl.dropboxusercontent.com/scl/fi/wkd6jvjj1e5nxh7pxpmcm/image-228.jpg?rlkey=t6pvyyvnems1zj63a53iw8toq&dl=1,definitions/English,English dancer who danced with Rudolf Nureyev (born in 1919),https://trueandfiction.com/definition/definition-of-fonteyn/,2024-12-28T19:29,"definition, meaning, english, vocabulary, fonteyn"
Definition of somalian shilling,https://dl.dropboxusercontent.com/scl/fi/shmfh2kqzuz5zfd4txksn/image-229.jpg?rlkey=7t4kkn1vuxg38s07t6sks05h7&dl=1,definitions/English,the basic unit of money in Somalia; equal to 100 cents,https://trueandfiction.com/definition/definition-of-somalian-shilling/,2024-12-28T19:32,"definition, meaning, english, vocabulary, somalian shilling"
Definition of waterleaf,https://dl.dropboxusercontent.com/scl/fi/zohty89e8u6dyc9cv8dex/image-230.jpg?rlkey=bl23v1xq8iajnlv4xzdlthh9m&dl=1,definitions/English,any of several plants of the genus Hydrophyllum,https://trueandfiction.com/definition/definition-of-waterleaf/,2024-12-28T19:35,"definition, meaning, english, vocabulary, waterleaf"
Definition of celastrus orbiculatus,https://dl.dropboxusercontent.com/scl/fi/6l2pmzywx37hb159nulb8/image-231.jpg?rlkey=7k7lgv21g1sbhki0lu2us971f&dl=1,definitions/English,ornamental Asiatic vine with showy orange-yellow fruit with a scarlet aril; naturalized in North America,https://trueandfiction.com/definition/definition-of-celastrus-orbiculatus/,2024-12-28T19:38,"definition, meaning, english, vocabulary, celastrus orbiculatus"
Definition of auditory canal,https://dl.dropboxusercontent.com/scl/fi/65oybvaw07735yij7act5/image-232.jpg?rlkey=xxd5igeq4lt4nfx8g8qjmqejn&dl=1,definitions/English,either of the passages in the outer ear from the auricle to the tympanic membrane,https://trueandfiction.com/definition/definition-of-auditory-canal/,2024-12-28T19:41,"definition, meaning, english, vocabulary, auditory canal"
Definition of angered,https://dl.dropboxusercontent.com/scl/fi/vd7mc08ypbfvbz5sag2h4/image-233.jpg?rlkey=hmr17qju8fxp8sdxhfds77har&dl=1,definitions/English,marked by extreme anger,https://trueandfiction.com/definition/definition-of-angered/,2024-12-28T19:45,"definition, meaning, english, vocabulary, angered"
Definition of mustard gas,https://dl.dropboxusercontent.com/scl/fi/vo9byrvw05bu1qrvjbaho/image-234.jpg?rlkey=2nh800n2nz92yd8qvr4mig5pk&dl=1,definitions/English,a toxic war gas with sulfide based compounds that raises blisters and attacks the eyes and lungs; there is no known antidote,https://trueandfiction.com/definition/definition-of-mustard-gas/,2024-12-28T19:48,"definition, meaning, english, vocabulary, mustard gas"
Definition of variable-pitch propeller,https://dl.dropboxusercontent.com/scl/fi/zoqna66skmyho5gw9k1rc/image-235.jpg?rlkey=7ihjtk2x6el48rma6kh12xy3q&dl=1,definitions/English,propeller for which the angle of the blades is adjustable,https://trueandfiction.com/definition/definition-of-variable-pitch-propeller/,2024-12-28T19:51,"definition, meaning, english, vocabulary, variable-pitch propeller"
Definition of entireness,https://dl.dropboxusercontent.com/scl/fi/s1l2aqssesa4g4xs37029/image-236.jpg?rlkey=fh3h6y8fmktf8ulxii4251mr1&dl=1,definitions/English,the state of being total and complete,https://trueandfiction.com/definition/definition-of-entireness/,2024-12-28T19:55,"definition, meaning, english, vocabulary, entireness"
Definition of genus amauropelta,https://dl.dropboxusercontent.com/scl/fi/ppvjcmdeqihk8opiidio6/image-237.jpg?rlkey=yche6k3zk9ijfgaeisbmijgqx&dl=1,definitions/English,epiphytic or terrestrial ferns of America and Africa and Polynesia,https://trueandfiction.com/definition/definition-of-genus-amauropelta/,2024-12-28T19:58,"definition, meaning, english, vocabulary, genus amauropelta"
Definition of ignition,https://dl.dropboxusercontent.com/scl/fi/5632ox4crgwratdas4fgz/image-238.jpg?rlkey=rc9pgmdeb4ggyuki2ewkybnmy&dl=1,definitions/English,the mechanism that ignites the fuel in an internal-combustion engine,https://trueandfiction.com/definition/definition-of-ignition/,2024-12-28T19:02,"definition, meaning, english, vocabulary, ignition"
Definition of kayoed,https://dl.dropboxusercontent.com/scl/fi/4xrw51ztzr4af5pwp1csa/image-239.jpg?rlkey=myytbtwmf56j3qn4r23u9wlli&dl=1,definitions/English,knocked unconscious by a heavy blow,https://trueandfiction.com/definition/definition-of-kayoed/,2024-12-28T19:05,"definition, meaning, english, vocabulary, kayoed"
Definition of yawn,https://dl.dropboxusercontent.com/scl/fi/b2lne4hahnbn5bpx5j6er/image-240.jpg?rlkey=zvtm3rwvcr263j187aqvddpyd&dl=1,definitions/English,an involuntary intake of breath through a wide open mouth; usually triggered by fatigue or boredom,https://trueandfiction.com/definition/definition-of-yawn/,2024-12-28T19:09,"definition, meaning, english, vocabulary, yawn"
Definition of africanized bee,https://dl.dropboxusercontent.com/scl/fi/ema84eduoir3x4wyoh8nj/image-241.jpg?rlkey=bmazyrqknwk1d75lmeet8n833&dl=1,definitions/English,a strain of bees that originated in Brazil in the 1950s as a cross between an aggressive African bee and a honeybee; retains most of the traits of the African bee; now spread as far north as Texas,https://trueandfiction.com/definition/definition-of-africanized-bee/,2024-12-28T19:13,"definition, meaning, english, vocabulary, africanized bee"
Definition of placebo,https://dl.dropboxusercontent.com/scl/fi/i1zjldwlmtnt9w5lgnu46/image-242.jpg?rlkey=vdu52ykmpuz9wahadn5f8avio&dl=1,definitions/English,(Roman Catholic Church) vespers of the office for the dead,https://trueandfiction.com/definition/definition-of-placebo/,2024-12-28T19:16,"definition, meaning, english, vocabulary, placebo"
Definition of columnar cell,https://dl.dropboxusercontent.com/scl/fi/pvv38juct24vooipo016h/image-243.jpg?rlkey=rejx49la7yufyqvnnf8n64dow&dl=1,definitions/English,an epithelial cell that is shaped like a column; some have cilia,https://trueandfiction.com/definition/definition-of-columnar-cell/,2024-12-28T19:20,"definition, meaning, english, vocabulary, columnar cell"
Definition of rug pad,https://dl.dropboxusercontent.com/scl/fi/ids1vsrok4hwzvggrp0cq/image-244.jpg?rlkey=1f6mch55zvk073y1821n9j6ov&dl=1,definitions/English,a pad placed under a carpet,https://trueandfiction.com/definition/definition-of-rug-pad/,2024-12-28T19:24,"definition, meaning, english, vocabulary, rug pad"
Definition of swallow-tailed,https://dl.dropboxusercontent.com/scl/fi/5sgrpz0mah81vt84mo2nk/image-245.jpg?rlkey=ktb51l5m2c07xdg9hv8ym3vsu&dl=1,definitions/English,(especially of butterflies and birds) having a forked tail like that of a swallow,https://trueandfiction.com/definition/definition-of-swallow-tailed/,2024-12-28T19:28,"definition, meaning, english, vocabulary, swallow-tailed"
Definition of tapiridae,https://dl.dropboxusercontent.com/scl/fi/dl8jxzzdg24uhtn7oxokq/image-246.jpg?rlkey=nrz9qh62qaobomef3dkxixbgj&dl=1,definitions/English,tapirs and extinct related forms,https://trueandfiction.com/definition/definition-of-tapiridae/,2024-12-28T19:33,"definition, meaning, english, vocabulary, tapiridae"
Definition of palermo,https://dl.dropboxusercontent.com/scl/fi/nc6s8fhogtt43ryvsw6qq/image-247.jpg?rlkey=8qnxfi93j5qtulr1iu5vd6jz6&dl=1,definitions/English,the capital of Sicily; located in northwestern Sicily; an important port for 3000 years,https://trueandfiction.com/definition/definition-of-palermo/,2024-12-28T19:37,"definition, meaning, english, vocabulary, palermo"
Definition of old world mistletoe,https://dl.dropboxusercontent.com/scl/fi/hhhgrfn1i7vvcoxyn5b87/image-248.jpg?rlkey=wlo2x9d16jfosdfzcwrfy9o2a&dl=1,definitions/English,Old World parasitic shrub having branching greenish stems with leathery leaves and waxy white glutinous berries; the traditional mistletoe of Christmas,https://trueandfiction.com/definition/definition-of-old-world-mistletoe/,2024-12-28T19:41,"definition, meaning, english, vocabulary, old world mistletoe"
Definition of beaked,https://dl.dropboxusercontent.com/scl/fi/0wzru6divq9vs3heg3kkl/image-249.jpg?rlkey=5pxvcrtbjqy0ixmjf2dsvg65h&dl=1,definitions/English,having or resembling a beak,https://trueandfiction.com/definition/definition-of-beaked/,2024-12-28T19:46,"definition, meaning, english, vocabulary, beaked"
Definition of awe,https://dl.dropboxusercontent.com/scl/fi/i5xmv00dhcwmh9ufacw21/image-250.jpg?rlkey=t0fms555f8n8jzpx87fqnasgy&dl=1,definitions/English,an overwhelming feeling of wonder or admiration,https://trueandfiction.com/definition/definition-of-awe/,2024-12-28T19:50,"definition, meaning, english, vocabulary, awe"
Definition of sea of japan,https://dl.dropboxusercontent.com/scl/fi/5pjrv2j8211527ha3kzie/image-251.jpg?rlkey=e79tdfjblvl261tjyubmyt7ls&dl=1,definitions/English,"an arm of the Pacific bordered by Japan, Korea, North Korea, and Russia",https://trueandfiction.com/definition/definition-of-sea-of-japan/,2024-12-28T19:55,"definition, meaning, english, vocabulary, sea of japan"
Definition of hart crane,https://dl.dropboxusercontent.com/scl/fi/8zpeak5zdjz8xw9iw0j3v/image-252.jpg?rlkey=sr59nq230j97ciqm92lqjyal9&dl=1,definitions/English,United States poet (1899-1932),https://trueandfiction.com/definition/definition-of-hart-crane/,2024-12-28T20:00,"definition, meaning, english, vocabulary, hart crane"
Definition of moneyman,https://dl.dropboxusercontent.com/scl/fi/0fvuvegszbboaz08pz5ur/image-253.jpg?rlkey=adt49c5kktwxlfrzesgu9psqd&dl=1,definitions/English,a person skilled in large scale financial transactions,https://trueandfiction.com/definition/definition-of-moneyman/,2024-12-28T20:01,"definition, meaning, english, vocabulary, moneyman"
Definition of inverse,https://dl.dropboxusercontent.com/scl/fi/ha51itu5gpqne7luirkuu/image-254.jpg?rlkey=7ee8y6gu6zipqo6e0th5goba8&dl=1,definitions/English,reversed (turned backward) in order or nature or effect,https://trueandfiction.com/definition/definition-of-inverse/,2024-12-28T20:03,"definition, meaning, english, vocabulary, inverse"
Definition of democratise,https://dl.dropboxusercontent.com/scl/fi/kixjwagebmtzq1ar7z9kc/image-255.jpg?rlkey=a6k0tjcnfz4d6o5qsmdcrs4jo&dl=1,definitions/English,become (more) democratic; of nations,https://trueandfiction.com/definition/definition-of-democratise/,2024-12-28T20:05,"definition, meaning, english, vocabulary, democratise"
Definition of atheistical,https://dl.dropboxusercontent.com/scl/fi/5ale4h77e92bqcw1etqmd/image-256.jpg?rlkey=5qcbfpc5szag9f7wprluadsuy&dl=1,definitions/English,related to or characterized by or given to atheism,https://trueandfiction.com/definition/definition-of-atheistical/,2024-12-28T20:07,"definition, meaning, english, vocabulary, atheistical"
Definition of gangsaw,https://dl.dropboxusercontent.com/scl/fi/qh4ko3udte6jbjaclvxiu/image-257.jpg?rlkey=maz8u3wvujuj4536punj0qmww&dl=1,definitions/English,a power saw that has several parallel blades making simultaneous cuts,https://trueandfiction.com/definition/definition-of-gangsaw/,2024-12-28T20:09,"definition, meaning, english, vocabulary, gangsaw"
Definition of dorothy sayers,https://dl.dropboxusercontent.com/scl/fi/0u4a1mpvsb83zzww0czph/image-258.jpg?rlkey=mq40wupfokaa8lwd5v93htzwa&dl=1,definitions/English,English writer of detective fiction (1893-1957),https://trueandfiction.com/definition/definition-of-dorothy-sayers/,2024-12-28T20:11,"definition, meaning, english, vocabulary, dorothy sayers"
Definition of ovenbird,https://dl.dropboxusercontent.com/scl/fi/c2u5u0a2zut9l8hdf6ar6/image-259.jpg?rlkey=agyrfi2532t75t50ka12jdwst&dl=1,definitions/English,American warbler; builds a dome-shaped nest on the ground,https://trueandfiction.com/definition/definition-of-ovenbird/,2024-12-28T20:13,"definition, meaning, english, vocabulary, ovenbird"
Definition of abaca,https://dl.dropboxusercontent.com/scl/fi/1evj8mgtu82oawjk665ko/image-260.jpg?rlkey=gtccjufmguwjoy5df1rhyxx1l&dl=1,definitions/English,Philippine banana tree having leafstalks that yield Manila hemp used for rope and paper etc,https://trueandfiction.com/definition/definition-of-abaca/,2024-12-28T20:15,"definition, meaning, english, vocabulary, abaca"
Definition of genus epilachna,https://dl.dropboxusercontent.com/scl/fi/z0j68v1vc2z924mq5zvd8/image-261.jpg?rlkey=svp20t90bq57wpd8xop0qhigg&dl=1,definitions/English,genus of ladybugs native to Mexico and Central America; both larvae and adults feed on plants,https://trueandfiction.com/definition/definition-of-genus-epilachna/,2024-12-28T20:17,"definition, meaning, english, vocabulary, genus epilachna"
Definition of trackless,https://dl.dropboxusercontent.com/scl/fi/uveyv6y2s35qjjqfzuswz/image-262.jpg?rlkey=8bftkqpk486dinvk4bodlxdfa&dl=1,definitions/English,lacking pathways,https://trueandfiction.com/definition/definition-of-trackless/,2024-12-28T20:19,"definition, meaning, english, vocabulary, trackless"
Definition of pelargonium hortorum,https://dl.dropboxusercontent.com/scl/fi/26gm5l1sa38ogiqkzdinu/image-263.jpg?rlkey=nh77xb7dm6fqrku4dgxhmolgp&dl=1,definitions/English,an upright geranium having scalloped leaves with a broad color zone inside the margin and white or pink or red flowers,https://trueandfiction.com/definition/definition-of-pelargonium-hortorum/,2024-12-28T20:21,"definition, meaning, english, vocabulary, pelargonium hortorum"
Definition of pieris,https://dl.dropboxusercontent.com/scl/fi/gvs6nxpjhfaggkeg5ri0r/image-264.jpg?rlkey=o95o632v526tg4eut49oiqelr&dl=1,definitions/English,type genus of the Pieridae,https://trueandfiction.com/definition/definition-of-pieris/,2024-12-28T20:23,"definition, meaning, english, vocabulary, pieris"
Definition of hemodynamics,https://dl.dropboxusercontent.com/scl/fi/n6w4qz3q5wbvy9gs2o96g/image-265.jpg?rlkey=f4tfm47065npuwzdkii3xflri&dl=1,definitions/English,the branch of physiology that studies the circulation of the blood and the forces involved,https://trueandfiction.com/definition/definition-of-hemodynamics/,2024-12-28T20:25,"definition, meaning, english, vocabulary, hemodynamics"
Definition of variable,https://dl.dropboxusercontent.com/scl/fi/it9mt89gil5qwym17yx9o/image-266.jpg?rlkey=f4xs49i1i8olq3w4v2fltcxy1&dl=1,definitions/English,something that is likely to vary; something that is subject to variation,https://trueandfiction.com/definition/definition-of-variable/,2024-12-28T20:27,"definition, meaning, english, vocabulary, variable"
Definition of lord george gordon byron,https://dl.dropboxusercontent.com/scl/fi/tmuy35i7z0snm76h30php/image-267.jpg?rlkey=l2a5g7ek7j27c85x2kp74qwrt&dl=1,definitions/English,English romantic poet notorious for his rebellious and unconventional lifestyle (1788-1824),https://trueandfiction.com/definition/definition-of-lord-george-gordon-byron/,2024-12-28T20:29,"definition, meaning, english, vocabulary, lord george gordon byron"
Definition of glyptography,https://dl.dropboxusercontent.com/scl/fi/nqb4uhk90sadnczqkc118/image-268.jpg?rlkey=ciliioqr62u4oi2tzg1nuudo5&dl=1,definitions/English,carving or engraving (especially on stones),https://trueandfiction.com/definition/definition-of-glyptography/,2024-12-28T20:31,"definition, meaning, english, vocabulary, glyptography"
Definition of kendal,https://dl.dropboxusercontent.com/scl/fi/yz3667sogzprb37n80kac/image-269.jpg?rlkey=kf0we7vdohv0yojeqqoauvfdf&dl=1,definitions/English,"a green dye, often used to color cloth, which is obtained from the woad plant",https://trueandfiction.com/definition/definition-of-kendal/,2024-12-28T20:33,"definition, meaning, english, vocabulary, kendal"
Definition of flu,https://dl.dropboxusercontent.com/scl/fi/92mzyfnu4ary08vh82gi6/image-270.jpg?rlkey=84coo0mnahp6ixta0gat2d3ew&dl=1,definitions/English,an acute febrile highly contagious viral disease,https://trueandfiction.com/definition/definition-of-flu/,2024-12-28T20:35,"definition, meaning, english, vocabulary, flu"
Definition of umbrella tent,https://dl.dropboxusercontent.com/scl/fi/mvw5bswgpsydzngdh2tpc/image-271.jpg?rlkey=17gu41trih8dtpeybhxwagcu2&dl=1,definitions/English,a small tent with a single supporting pole and radiating metal ribs,https://trueandfiction.com/definition/definition-of-umbrella-tent/,2024-12-28T20:38,"definition, meaning, english, vocabulary, umbrella tent"
